{
  "$schema": "http://json-schema.org/draft-07/schema#",
  "title": "Elementor Data Schema",
  "description": "Valida que el _elementor_data sea un array plano de containers nativos",
  "type": "array",
  "minItems": 1,
  "items": {
    "type": "object",
    "required": ["elType", "settings", "elements", "id"],
    "properties": {
      "elType": {
        "type": "string",
        "enum": ["container", "widget"],
        "description": "Tipo de elemento Elementor. NUNCA 'section' o 'column'."
      },
      "id": {
        "type": "string",
        "minLength": 4,
        "description": "ID único hexadecimal del elemento"
      },
      "settings": {
        "type": "object",
        "description": "Configuración del elemento. No debe contener claves 'version' o 'content' en la raíz del array."
      },
      "elements": {
        "type": "array",
        "description": "Elementos hijos del container"
      }
    },
    "not": {
      "required": ["version", "content"],
      "description": "Rechaza el wrapper {version, content} que rompe Elementor con error 500"
    }
  }
}
